{
  "schema_version": "1.0",
  "library_id": "power-iteration-bridge-library-v1",
  "topic_id": "power-iteration",
  "status": "candidate",
  "generated_by": {
    "agent": "grounded-bridge-library-builder",
    "agent_version": "1.0",
    "skill": "build-grounded-bridge-library",
    "skill_version": "1.0",
    "generated_at": "2026-08-18T16:12:17Z"
  },
  "curriculum_model_binding": {
    "model_id": "power-iteration-dependencies-v2",
    "file": "curriculum-models/power-iteration-v1/release/frozen-contract-dependencies.json",
    "sha256": "9952915a368244e7110233a06d9976ba76e6ff4f9a702886ff0db20b33170ee6"
  },
  "pathway_bindings": [
    {
      "pathway_id": "power-iteration-p2-applied-mathematics-run-01-revision-v2",
      "pathway_file": "experiments/rq2/pathway-plans/power-iteration-v1/p2/applied-mathematics/run-03/pathway-plan.json",
      "pathway_sha256": "fad9a6bd91aa954cb0b5e8931f03edcab64990d8b330ec328a7ecd803a08a4a6",
      "review_file": "experiments/rq2/pathway-plans/power-iteration-v1/p2/applied-mathematics/run-03/pathway-plan-review.json",
      "review_sha256": "9833f870cb9b6cbd9012b311a1a562c1102d961e7fa50483e3cce0ebb3f10589",
      "profile_id": "applied-mathematics-year-2-rq2-pilot"
    },
    {
      "pathway_id": "power-iteration-p2-computer-science-v1-revision-v1",
      "pathway_file": "experiments/rq2/pathway-plans/power-iteration-v1/p2/computer-science/run-02/pathway-plan.json",
      "pathway_sha256": "d7bdb6766a58b279e82904aab170c5965291d262771869a1bd45c2fbb4db4bd6",
      "review_file": "experiments/rq2/pathway-plans/power-iteration-v1/p2/computer-science/run-02/pathway-plan-review.json",
      "review_sha256": "5acb05380fbeb1c1c202b955c2b5ea4c3a1b9b9db458ab0e2c14366ecf11d7f5",
      "profile_id": "computer-science-year-2-rq2-pilot"
    },
    {
      "pathway_id": "power-iteration-p2-mechanical-engineering-year-2-v1-revision-v1",
      "pathway_file": "experiments/rq2/pathway-plans/power-iteration-v1/p2/mechanical-engineering/run-02/pathway-plan.json",
      "pathway_sha256": "6f2f1c9add7b1a7b595e9e8d3a831100f28dda36649bdaba397db1f6642f4491",
      "review_file": "experiments/rq2/pathway-plans/power-iteration-v1/p2/mechanical-engineering/run-02/pathway-plan-review.json",
      "review_sha256": "ce1255a412b7b03de0cabf76782458cc40af77e8602c5563afd0445b78036174",
      "profile_id": "mechanical-engineering-year-2-rq2-pilot"
    }
  ],
  "bridges": [
    {
      "bridge_contract_id": "BRC-VECTOR-NORMS-NORMALIZATION-v1",
      "bridge_candidate_id": "BR-VECTOR-NORMS-NORMALIZATION-v1",
      "concept_id": "vector-norms-and-normalization",
      "name": "Euclidean vector norms and normalization",
      "status": "candidate",
      "requested_by_profile_ids": [
        "computer-science-year-2-rq2-pilot",
        "mechanical-engineering-year-2-rq2-pilot"
      ],
      "supports_item_ids": ["RC-005", "RC-010", "RC-016", "RC-017"],
      "content_boundary": "Define the Euclidean norm, normalize a non-zero vector, and recognize zero-vector breakdown; exclude general normed-space theory.",
      "learning_outcomes": [
        {"outcome_id": "BO-01", "text": "Compute the Euclidean norm of a real vector."},
        {"outcome_id": "BO-02", "text": "Normalize a non-zero vector and verify that the result has unit Euclidean norm."},
        {"outcome_id": "BO-03", "text": "Recognize that the zero vector cannot be normalized by division by its norm."}
      ],
      "teaching_content": [
        {
          "content_id": "BC-01",
          "kind": "definition",
          "text": "For x = (x_1, ..., x_n)^T in R^n, the Euclidean norm is ||x||_2 = sqrt(x_1^2 + ... + x_n^2) = sqrt(x^T x).",
          "source_ids": ["SRC-01"]
        },
        {
          "content_id": "BC-02",
          "kind": "procedure",
          "text": "For x != 0, compute r = ||x||_2 and set u = x/r. Then ||u||_2 = 1.",
          "source_ids": ["SRC-01"]
        },
        {
          "content_id": "BC-03",
          "kind": "safeguard",
          "text": "If ||x||_2 = 0, then x is the zero vector and x/||x||_2 is undefined; stop before dividing.",
          "source_ids": ["SRC-01"]
        },
        {
          "content_id": "BC-04",
          "kind": "worked_example",
          "text": "For x = (3, 4)^T, ||x||_2 = 5 and the normalized vector is (3/5, 4/5)^T.",
          "source_ids": ["SRC-01"]
        }
      ],
      "excluded_content": [
        "General p-norm and normed-space theory",
        "Matrix norms",
        "Power-iteration update or convergence claims"
      ],
      "sources": [
        {
          "source_id": "SRC-01",
          "title": "Lecture Notes for Linear Algebra",
          "provider": "Massachusetts Institute of Technology",
          "url": "https://math.mit.edu/~gs/LectureNotes/",
          "source_type": "institutional_course_material",
          "accessed_at": "2026-08-18",
          "evidence_locator": "Detailed table of contents, Sections 1.2 (dot products and lengths) and 4.6 (vector norms)",
          "supports_content_ids": ["BC-01", "BC-02", "BC-03", "BC-04"]
        }
      ]
    },
    {
      "bridge_contract_id": "BRC-ORTHOGONALITY-PROJECTION-v1",
      "bridge_candidate_id": "BR-ORTHOGONALITY-PROJECTION-v1",
      "concept_id": "orthogonality-and-projection",
      "name": "Orthogonality, orthonormal bases, and projection coefficients",
      "status": "candidate",
      "requested_by_profile_ids": [
        "computer-science-year-2-rq2-pilot",
        "mechanical-engineering-year-2-rq2-pilot"
      ],
      "supports_item_ids": ["RC-003", "RC-006", "RC-007", "RC-012"],
      "content_boundary": "Use inner products to explain orthogonality, orthonormal bases, and scalar projection coefficients v_i^T x; exclude the spectral theorem and eigenbasis expansion because those belong to RC-003 and RC-006.",
      "learning_outcomes": [
        {"outcome_id": "BO-01", "text": "Test whether two real vectors are orthogonal using their inner product."},
        {"outcome_id": "BO-02", "text": "Recognize an orthonormal family from zero cross-products and unit norms."},
        {"outcome_id": "BO-03", "text": "Compute the scalar coefficient v^T x when v is a unit vector."}
      ],
      "teaching_content": [
        {
          "content_id": "BC-01",
          "kind": "definition",
          "text": "Real vectors u and v are orthogonal when u^T v = 0.",
          "source_ids": ["SRC-01"]
        },
        {
          "content_id": "BC-02",
          "kind": "definition",
          "text": "Vectors v_1, ..., v_k are orthonormal when v_i^T v_j = 0 for i != j and ||v_i||_2 = 1.",
          "source_ids": ["SRC-01", "SRC-02"]
        },
        {
          "content_id": "BC-03",
          "kind": "procedure",
          "text": "For a unit vector v, calculate v^T x to obtain the scalar coefficient of x in the v direction; the corresponding vector projection is (v^T x)v.",
          "source_ids": ["SRC-02"]
        },
        {
          "content_id": "BC-04",
          "kind": "worked_example",
          "text": "For v = (1, 0)^T and x = (3, 4)^T, v^T x = 3 and the projection onto span(v) is (3, 0)^T.",
          "source_ids": ["SRC-02"]
        }
      ],
      "excluded_content": [
        "The spectral theorem",
        "Eigenbasis expansion of an iterate",
        "Power-iteration convergence or failure results"
      ],
      "sources": [
        {
          "source_id": "SRC-01",
          "title": "Orthogonal Matrices and Gram-Schmidt",
          "provider": "MIT OpenCourseWare",
          "url": "https://ocw.mit.edu/courses/18-06sc-linear-algebra-fall-2011/pages/least-squares-determinants-and-eigenvalues/orthogonal-matrices-and-gram-schmidt/",
          "source_type": "institutional_course_material",
          "accessed_at": "2026-08-18",
          "evidence_locator": "Session overview and accompanying Lecture 17 materials on orthonormal vectors",
          "supports_content_ids": ["BC-01", "BC-02"]
        },
        {
          "source_id": "SRC-02",
          "title": "Projections onto Subspaces",
          "provider": "MIT OpenCourseWare",
          "url": "https://ocw.mit.edu/courses/18-06sc-linear-algebra-fall-2011/pages/least-squares-determinants-and-eigenvalues/projections-onto-subspaces/",
          "source_type": "institutional_course_material",
          "accessed_at": "2026-08-18",
          "evidence_locator": "Session overview and accompanying Lecture 15 projection materials",
          "supports_content_ids": ["BC-02", "BC-03", "BC-04"]
        }
      ]
    },
    {
      "bridge_contract_id": "BRC-INNER-PRODUCTS-QUADRATIC-FORMS-v1",
      "bridge_candidate_id": "BR-INNER-PRODUCTS-QUADRATIC-FORMS-v1",
      "concept_id": "inner-products-and-quadratic-forms",
      "name": "Inner products and quadratic forms",
      "status": "candidate",
      "requested_by_profile_ids": [
        "computer-science-year-2-rq2-pilot",
        "mechanical-engineering-year-2-rq2-pilot"
      ],
      "supports_item_ids": ["RC-009", "RC-010"],
      "content_boundary": "Compute x^T A x, x^T x, and compatible scalar-vector expressions used by the Rayleigh quotient and residual; exclude general quadratic-form classification.",
      "learning_outcomes": [
        {"outcome_id": "BO-01", "text": "Compute x^T y and identify the scalar result."},
        {"outcome_id": "BO-02", "text": "Compute x^T A x by forming Ax and then taking the inner product with x."},
        {"outcome_id": "BO-03", "text": "Relate x^T x to the squared Euclidean norm without classifying general quadratic forms."}
      ],
      "teaching_content": [
        {
          "content_id": "BC-01",
          "kind": "definition",
          "text": "For real vectors x and y of the same length, x^T y is the scalar sum of componentwise products.",
          "source_ids": ["SRC-01"]
        },
        {
          "content_id": "BC-02",
          "kind": "procedure",